{
  "id": "stonkfun",
  "name": "StonkFun",
  "website": "https://www.stonkfun.xyz",
  "chain": {
    "family": "solana",
    "id": "mainnet-beta"
  },
  "status": "active",
  "firstSeen": "2025-09-01",
  "model": "bonding-curve",
  "builtOn": "raydium-launchlab",
  "contracts": [
    {
      "address": "6BwHHDg3u1854jC8PDLXvR4spTcLNaoBxLJNGC4nTESt",
      "role": "platform-config",
      "checked": "2026-10-21"
    },
    {
      "address": "4E876qZTE9FJMrBzgVtBrSrzz2TLivB5Y5QXPjB4gZL7",
      "role": "platform-config",
      "checked": "2026-10-21"
    },
    {
      "address": "CUqSiwPs6C4WyntMgaFazLp7wYQfaLp5URbjUP9V7SNi",
      "role": "platform-config",
      "checked": "2026-10-21"
    }
  ],
  "launch": {
    "kind": "instruction",
    "name": "initialize",
    "discriminator": "afaf6d1f0d989bed",
    "tokenField": "accounts[6] (base_mint)",
    "creatorField": "accounts[1] (creator)"
  },
  "token": {
    "standard": "spl",
    "metadata": "metaplex",
    "decimals": 6
  },
  "graduation": {
    "target": "raydium-cpmm"
  },
  "quotes": [
    "SOL"
  ],
  "tags": [
    "stocks-theme",
    "frontend"
  ],
  "sources": [
    "https://www.stonkfun.xyz",
    "https://solscan.io/account/6BwHHDg3u1854jC8PDLXvR4spTcLNaoBxLJNGC4nTESt"
  ],
  "updated": "2026-10-21",
  "logo": "icons/stonkfun.png",
  "lastActivity": "2026-10-21"
}
