{
  "id": "virtuals-robinhood",
  "name": "Virtuals Protocol (Robinhood Chain)",
  "website": "https://app.virtuals.io",
  "chain": {
    "family": "evm",
    "id": 4663
  },
  "status": "active",
  "firstSeen": "2026-07-01",
  "model": "bonding-curve",
  "contracts": [
    {
      "address": "0xd4ccbfa37e2f35611b3042e4096ad7a3459bd007",
      "role": "router",
      "label": "launch router (emits PreLaunched)",
      "checked": "2026-10-23"
    },
    {
      "address": "0x43E4C17b15365596Caae8e7d00E42Bc8E988c2d4",
      "role": "factory",
      "label": "factory/registry (NewApplication, deploys tokens)",
      "checked": "2026-10-23"
    },
    {
      "address": "0xc6911796042b15d7fa4f6cde69e245ddcd3d9c31",
      "role": "token",
      "label": "VIRTUAL (quote asset)",
      "checked": "2026-10-23"
    },
    {
      "address": "0xfc2e4da3edb2e18100473339c763705d263d20a9",
      "role": "other",
      "label": "Virtuals-side pair factory (proxy)",
      "checked": "2026-10-23"
    }
  ],
  "launch": {
    "kind": "event",
    "name": "PreLaunched",
    "topic0": "0xb9ee8aa6d909a3efd0bf1b0bc2bde7f998f7ad30178b0d45f9227f5382cebc8f",
    "tokenField": "topics[1]",
    "notes": "pool = topics[2]. Bonds against $VIRTUAL, not ETH."
  },
  "token": {
    "standard": "erc20",
    "metadata": "api",
    "decimals": 18
  },
  "graduation": {
    "target": "uniswap-v2",
    "notes": "Virtuals-style graduation to its own pair factory"
  },
  "quotes": ["VIRTUAL"],
  "tags": ["bonding-curve", "ai-agents"],
  "sources": [
    "https://robinhoodchain.blockscout.com/address/0x43E4C17b15365596Caae8e7d00E42Bc8E988c2d4"
  ],
  "notes": "",
  "updated": "2026-10-23",
  "logo": "icons/virtuals-robinhood.png",
  "fixtures": [
    {
      "tx": "0x3caea31db7628c967ed8fe14888bda81504f27db25bc14b787e74b31c9935eab",
      "token": "0x5c6950dee60177a0fe95b0d96b7b6ca19c742c72",
      "creator": "0xe1e3c7c28089d47a736be3cd735185d278c91be4",
      "date": "2026-10-21",
      "note": "found by scripts/fixtures.mjs (topic0 in blocks 94579156-94584155)"
    },
    {
      "tx": "0x13c306e61efb24b54191f58bd7db9d496183364c2e13be64029ad3618bab1780",
      "token": "0x8be7a4b9239a8634874092264417d95fef5b48f6",
      "creator": "0x97532e7353f4408b803c06483dbe61fc9044c4e9",
      "date": "2026-10-21",
      "note": "found by scripts/fixtures.mjs (topic0 in blocks 94519895-94524894)"
    }
  ],
  "lastActivity": "2026-10-21"
}
