{
  "id": "launchhood",
  "name": "LaunchHood",
  "website": "https://dexscreener.com/robinhood",
  "chain": {
    "family": "evm",
    "id": 4663
  },
  "status": "active",
  "firstSeen": "2026-07-16",
  "model": "direct-pool",
  "contracts": [
    {
      "address": "0x62b33a039d289cbda50ebeb72fe4261449e61bcf",
      "role": "launcher",
      "label": "LaunchHoodV3Factory (cluster by tx.to)",
      "checked": "2026-10-23"
    }
  ],
  "launch": {
    "kind": "event",
    "name": "PoolCreated",
    "topic0": "0x783cca1c0412dd0d695e784568c96da2e9c22ff989357a2e8b1d9b2b4e6b7118",
    "notes": "Uniswap V3 launcher: new token + pool in one tx from this entrypoint. Launch ABI not decoded yet: PRs welcome."
  },
  "token": {
    "standard": "erc20",
    "metadata": "unknown",
    "decimals": 18
  },
  "graduation": {
    "target": "uniswap-v3"
  },
  "quotes": [
    "ETH"
  ],
  "tags": [
    "direct-pool",
    "needs-abi"
  ],
  "sources": [
    "https://robinhoodchain.blockscout.com/address/0x62b33a039d289cbda50ebeb72fe4261449e61bcf"
  ],
  "notes": "Website unknown; identified on-chain only.",
  "updated": "2026-10-26",
  "lastActivity": "2026-10-16"
}
