{
  "id": "doppler-robinhood",
  "name": "Doppler (Robinhood Chain)",
  "website": "https://doppler.lol",
  "chain": {
    "family": "evm",
    "id": 4663
  },
  "status": "active",
  "firstSeen": "2026-07-16",
  "model": "direct-pool",
  "contracts": [
    {
      "address": "0x4e3468951d49f2eea976ed0d6e75ffcb44a9a544",
      "role": "hook",
      "label": "DopplerHookInitializer",
      "checked": "2026-10-21"
    },
    {
      "address": "0x8366a39cc670b4001a1121b8f6a443a643e40951",
      "role": "other",
      "label": "Uniswap V4 PoolManager",
      "checked": "2026-10-21"
    }
  ],
  "launch": {
    "kind": "event",
    "name": "Initialize",
    "topic0": "0xdd466e674ea557f56295e2d0218a125ea4b4f0f6f3307b95f85e6110838d6438",
    "notes": "Uniswap V4: identify by hooks address in Initialize data."
  },
  "token": {
    "standard": "erc20",
    "metadata": "unknown",
    "decimals": 18
  },
  "graduation": {
    "target": "uniswap-v4"
  },
  "quotes": [
    "ETH"
  ],
  "tags": [
    "uniswap-v4",
    "hook"
  ],
  "sources": [
    "https://robinhoodchain.blockscout.com/address/0x4e3468951d49f2eea976ed0d6e75ffcb44a9a544"
  ],
  "notes": "",
  "updated": "2026-10-21",
  "logo": "icons/doppler-robinhood.png",
  "fixtures": [
    {
      "tx": "0x2457e14dff2a9bb3b77137f0b12d73857d8234cd5be0194e44f546c052019da4",
      "token": "0x4a0e65a3eccec6dbe60ae065f2e7bb85fae35eea",
      "creator": "0x43378e9b88da4d4e34056c975a689a626eff13f7",
      "date": "2026-10-21",
      "note": "found by scripts/fixtures.mjs (topic0 in blocks 94577634-94582633)"
    },
    {
      "tx": "0x5b485420b877b70975c600e1343fed1f37ca9603b1c7989cbe4728cad30d0aa3",
      "token": "0x0bd7d308f8e1639fab988df18a8011f41eacad73",
      "creator": "0x9ec9cc60845566260bacfe8688e4f7ef9337bc34",
      "date": "2026-10-21",
      "note": "found by scripts/fixtures.mjs (topic0 in blocks 94572564-94577563)"
    }
  ],
  "lastActivity": "2026-10-21"
}
