{
  "id": "pangea",
  "name": "Pangea",
  "website": "https://pangea.trade",
  "socials": {
    "x": "LaunchOnPangea"
  },
  "chain": {
    "family": "solana",
    "id": "mainnet-beta"
  },
  "status": "active",
  "firstSeen": "2026-10-18",
  "model": "direct-pool",
  "contracts": [
    {
      "address": "Hb5uTppRbNxc3RjVRqTWqfdU3E3GiZyGYKccxYf9tUej",
      "role": "program",
      "label": "Pangea launch program (Launch ix: mint + OFT + DAMM v2 pool + permanent lock)",
      "checked": "2026-10-23"
    },
    {
      "address": "SNyKyiZYU4R54SF9sYLmjCaCUsa1sC6QouNAj3x3Zzf",
      "role": "program",
      "label": "LayerZero OFT program (token is omnichain)",
      "checked": "2026-10-23"
    },
    {
      "address": "848jBDi9bJWoDwxhLGXsX3aXjSmdxsawSN3Tb32DyNgL",
      "role": "deployer",
      "label": "platform relayer/payer that signs every Launch",
      "checked": "2026-10-23"
    },
    {
      "address": "cpamdpZCGKUy5JxQXB4dcpGPiikHawvSWAd6mEn1sGG",
      "role": "other",
      "label": "Meteora DAMM v2 (pool created in the same tx)",
      "checked": "2026-10-23"
    }
  ],
  "launch": {
    "kind": "instruction",
    "name": "Launch",
    "notes": "Single tx: Token-2022 mint (PDA, not a signer) + LayerZero OFT init + DAMM v2 InitializeCustomizablePool + PermanentLockPosition. Tx carries a jitodontfront…Pangea account. Multi-chain: the EVM leg uses a Uniswap v4 hook (addresses not yet registered)."
  },
  "token": {
    "standard": "token-2022",
    "metadata": "token-2022-extension"
  },
  "graduation": {
    "target": "meteora-damm-v2",
    "notes": "No curve: liquid from block one, LP permanently locked."
  },
  "quotes": ["SOL"],
  "tags": ["direct-pool", "omnichain", "layerzero"],
  "sources": [
    "https://pangea.trade",
    "https://solscan.io/account/Hb5uTppRbNxc3RjVRqTWqfdU3E3GiZyGYKccxYf9tUej"
  ],
  "updated": "2026-10-23",
  "logo": "icons/pangea.png",
  "fixtures": [
    {
      "tx": "2Aq2RqXYDDK6mHKfhSaGigy71BtLzWnKfCsuGyHsq7pKU4tWNVsC1HrPmGzDyF6pzPYWG4czowHt8VmLzGxXiWTe",
      "token": "9yt4FgjmjeiASRB5fTwKnuF6ZFYUzGLs9FYX3NCgg6ea",
      "creator": "848jBDi9bJWoDwxhLGXsX3aXjSmdxsawSN3Tb32DyNgL",
      "date": "2026-10-21",
      "note": "found by scripts/fixtures.mjs via program Hb5uTppR"
    },
    {
      "tx": "3sTRvLhtgc64PNB6ea9LgedCRomdj3NQisD4uAB2ThfpGP9526z88vjPyLKkaa5yewAvjq2Er9MZ9xtN4L8zEACB",
      "token": "DSABQrJ5q122rSHS1t266eXLN5hJQf7GXryEQJ9Yt6ea",
      "creator": "848jBDi9bJWoDwxhLGXsX3aXjSmdxsawSN3Tb32DyNgL",
      "date": "2026-10-21",
      "note": "found by scripts/fixtures.mjs via program Hb5uTppR"
    }
  ],
  "lastActivity": "2026-10-21"
}
