{
  "id": "meteora-dbc",
  "name": "Meteora Dynamic Bonding Curve",
  "website": "https://launch.meteora.ag",
  "socials": {
    "x": "MeteoraAG",
    "github": "https://github.com/MeteoraAg/dynamic-bonding-curve"
  },
  "chain": {
    "family": "solana",
    "id": "mainnet-beta"
  },
  "status": "active",
  "firstSeen": "2025-04-01",
  "model": "bonding-curve",
  "contracts": [
    {
      "address": "dbcij3LWUppWqq96dh6gJWwBifmcGfLSB5D4DuSMaqN",
      "role": "program",
      "label": "Dynamic Bonding Curve",
      "verified": true,
      "checked": "2026-10-23"
    },
    {
      "address": "cpamdpZCGKUy5JxQXB4dcpGPiikHawvSWAd6mEn1sGG",
      "role": "other",
      "label": "DAMM v2 (default graduation target)",
      "verified": true,
      "checked": "2026-10-23"
    },
    {
      "address": "Eo7WjKq67rjJQSZxS6z3YkapzY3eMj6Xy8X5EQVn5UaB",
      "role": "other",
      "label": "DAMM v1 (alternative graduation target)",
      "verified": true,
      "checked": "2026-10-23"
    }
  ],
  "launch": {
    "kind": "instruction",
    "name": "initialize_virtual_pool_with_spl_token | initialize_virtual_pool_with_token2022",
    "notes": "Accounts: config, pool_authority, creator, base_mint, quote_mint, pool, base_vault, quote_vault, mint_metadata, metadata_program, payer, … config (accounts[0]) identifies the partner/frontend. Partners may also publish a PartnerMetadata account (create_partner_metadata) with name/website/logo. Migration is a separate tx (migration_damm_v2 / migrate_meteora_damm).",
    "tokenField": "accounts[3] (base_mint)",
    "creatorField": "accounts[2] (creator)"
  },
  "token": {
    "standard": "mixed",
    "metadata": "metaplex"
  },
  "graduation": {
    "target": "meteora-damm-v2",
    "address": "cpamdpZCGKUy5JxQXB4dcpGPiikHawvSWAd6mEn1sGG",
    "threshold": "per-config migration quote threshold",
    "notes": "Migration is a separate tx (migrate_meteora_damm / migration_damm_v2) that creates the DAMM pool and locks LP per config."
  },
  "quotes": [
    "SOL",
    "USDC",
    "custom"
  ],
  "tags": [
    "bonding-curve",
    "multi-tenant",
    "sdk"
  ],
  "sources": [
    "https://docs.meteora.ag/developer-guide/guides/dbc",
    "https://github.com/MeteoraAg/dynamic-bonding-curve",
    "https://solscan.io/account/dbcij3LWUppWqq96dh6gJWwBifmcGfLSB5D4DuSMaqN"
  ],
  "updated": "2026-10-26",
  "logo": "icons/meteora-dbc.png",
  "idl": "idl/meteora-dbc.json",
  "fixtures": [
    {
      "tx": "4g1LcYAtUU74HzGn7pNLZd6m11G1Z7QSaN68R8g7xkaFtKzjx4NnYZXuc7znLqDaN6GbyV6Xd2YLecPZQCfWeXdN",
      "token": "DoocYiBrTGxPvKkv9BuDJnDfA5f4DLa4P7axmVaNpump",
      "creator": "93LeHPNvjgRASr72GRgHHBtGLY4Nu3UkG1cBGZqZbKad",
      "date": "2026-10-21",
      "note": "found by scripts/fixtures.mjs via program dbcij3LW"
    }
  ],
  "externalIds": {
    "geckoterminal": "meteora-dbc"
  },
  "lastActivity": "2026-10-26"
}
