{
  "id": "launchproof",
  "name": "launchproof.fun",
  "website": "https://launchproof.fun",
  "chain": {
    "family": "evm",
    "id": 4663
  },
  "status": "unknown",
  "firstSeen": "2026-08-04",
  "model": "direct-pool",
  "contracts": [
    {
      "address": "0x000000e200088d55c39a11f609e5f667729ad49b",
      "role": "launcher",
      "label": "entrypoint seen 2026-08-04 (rotates)",
      "checked": "2026-10-21"
    }
  ],
  "launch": {
    "kind": "mint-only",
    "notes": "Rotates its tx.to entrypoint, which defeats tx.to-based identity: watch the DEX factory events (PoolCreated/Initialize) and the deployer instead."
  },
  "token": {
    "standard": "erc20",
    "metadata": "unknown",
    "decimals": 18
  },
  "graduation": {
    "target": "uniswap-v3"
  },
  "quotes": [
    "ETH"
  ],
  "tags": [
    "rotating-entrypoint"
  ],
  "sources": [
    "https://robinhoodchain.blockscout.com/address/0x000000e200088d55c39a11f609e5f667729ad49b"
  ],
  "notes": "",
  "updated": "2026-10-21"
}
